{
  "schema_version": "yanling.machine-first/v1",
  "generated_at": "2026-05-12T07:46:49Z",
  "module": "yanlingrpa.com/yanling/protocol",
  "counts": {
    "packages": 9,
    "symbols": 238,
    "interfaces": 20,
    "structs": 23,
    "functions": 6,
    "methods": 372,
    "named_types": 4,
    "func_types": 1,
    "consts": 184
  },
  "symbols": [
    {
      "id": "yanlingrpa.com/yanling/protocol/appgui#AppGuiLocator",
      "name": "AppGuiLocator",
      "qualified_name": "yanlingrpa.com/yanling/protocol/appgui.AppGuiLocator",
      "kind": "interface",
      "package": "appgui",
      "import_path": "yanlingrpa.com/yanling/protocol/appgui",
      "source": {
        "file": "appgui/appgui_locator.go",
        "line": 15,
        "column": 6
      },
      "package_file": "packages/yanlingrpa.com__yanling__protocol__appgui.json"
    },
    {
      "id": "yanlingrpa.com/yanling/protocol/appgui#AppGuiWindow",
      "name": "AppGuiWindow",
      "qualified_name": "yanlingrpa.com/yanling/protocol/appgui.AppGuiWindow",
      "kind": "interface",
      "package": "appgui",
      "import_path": "yanlingrpa.com/yanling/protocol/appgui",
      "source": {
        "file": "appgui/appgui_window.go",
        "line": 12,
        "column": 6
      },
      "package_file": "packages/yanlingrpa.com__yanling__protocol__appgui.json"
    },
    {
      "id": "yanlingrpa.com/yanling/protocol/appgui#AppKey",
      "name": "AppKey",
      "qualified_name": "yanlingrpa.com/yanling/protocol/appgui.AppKey",
      "kind": "named_type",
      "package": "appgui",
      "import_path": "yanlingrpa.com/yanling/protocol/appgui",
      "source": {
        "file": "appgui/appgui_const_enum.go",
        "line": 6,
        "column": 6
      },
      "package_file": "packages/yanlingrpa.com__yanling__protocol__appgui.json"
    },
    {
      "id": "yanlingrpa.com/yanling/protocol/appgui#KeyBack",
      "name": "KeyBack",
      "qualified_name": "yanlingrpa.com/yanling/protocol/appgui.KeyBack",
      "kind": "const",
      "package": "appgui",
      "import_path": "yanlingrpa.com/yanling/protocol/appgui",
      "source": {
        "file": "appgui/appgui_const_enum.go",
        "line": 10,
        "column": 2
      },
      "package_file": "packages/yanlingrpa.com__yanling__protocol__appgui.json"
    },
    {
      "id": "yanlingrpa.com/yanling/protocol/appgui#KeyBackspace",
      "name": "KeyBackspace",
      "qualified_name": "yanlingrpa.com/yanling/protocol/appgui.KeyBackspace",
      "kind": "const",
      "package": "appgui",
      "import_path": "yanlingrpa.com/yanling/protocol/appgui",
      "source": {
        "file": "appgui/appgui_const_enum.go",
        "line": 32,
        "column": 2
      },
      "package_file": "packages/yanlingrpa.com__yanling__protocol__appgui.json"
    },
    {
      "id": "yanlingrpa.com/yanling/protocol/appgui#KeyDelete",
      "name": "KeyDelete",
      "qualified_name": "yanlingrpa.com/yanling/protocol/appgui.KeyDelete",
      "kind": "const",
      "package": "appgui",
      "import_path": "yanlingrpa.com/yanling/protocol/appgui",
      "source": {
        "file": "appgui/appgui_const_enum.go",
        "line": 25,
        "column": 2
      },
      "package_file": "packages/yanlingrpa.com__yanling__protocol__appgui.json"
    },
    {
      "id": "yanlingrpa.com/yanling/protocol/appgui#KeyDone",
      "name": "KeyDone",
      "qualified_name": "yanlingrpa.com/yanling/protocol/appgui.KeyDone",
      "kind": "const",
      "package": "appgui",
      "import_path": "yanlingrpa.com/yanling/protocol/appgui",
      "source": {
        "file": "appgui/appgui_const_enum.go",
        "line": 28,
        "column": 2
      },
      "package_file": "packages/yanlingrpa.com__yanling__protocol__appgui.json"
    },
    {
      "id": "yanlingrpa.com/yanling/protocol/appgui#KeyEnter",
      "name": "KeyEnter",
      "qualified_name": "yanlingrpa.com/yanling/protocol/appgui.KeyEnter",
      "kind": "const",
      "package": "appgui",
      "import_path": "yanlingrpa.com/yanling/protocol/appgui",
      "source": {
        "file": "appgui/appgui_const_enum.go",
        "line": 24,
        "column": 2
      },
      "package_file": "packages/yanlingrpa.com__yanling__protocol__appgui.json"
    },
    {
      "id": "yanlingrpa.com/yanling/protocol/appgui#KeyHome",
      "name": "KeyHome",
      "qualified_name": "yanlingrpa.com/yanling/protocol/appgui.KeyHome",
      "kind": "const",
      "package": "appgui",
      "import_path": "yanlingrpa.com/yanling/protocol/appgui",
      "source": {
        "file": "appgui/appgui_const_enum.go",
        "line": 11,
        "column": 2
      },
      "package_file": "packages/yanlingrpa.com__yanling__protocol__appgui.json"
    },
    {
      "id": "yanlingrpa.com/yanling/protocol/appgui#KeyMenu",
      "name": "KeyMenu",
      "qualified_name": "yanlingrpa.com/yanling/protocol/appgui.KeyMenu",
      "kind": "const",
      "package": "appgui",
      "import_path": "yanlingrpa.com/yanling/protocol/appgui",
      "source": {
        "file": "appgui/appgui_const_enum.go",
        "line": 12,
        "column": 2
      },
      "package_file": "packages/yanlingrpa.com__yanling__protocol__appgui.json"
    },
    {
      "id": "yanlingrpa.com/yanling/protocol/appgui#KeyNext",
      "name": "KeyNext",
      "qualified_name": "yanlingrpa.com/yanling/protocol/appgui.KeyNext",
      "kind": "const",
      "package": "appgui",
      "import_path": "yanlingrpa.com/yanling/protocol/appgui",
      "source": {
        "file": "appgui/appgui_const_enum.go",
        "line": 29,
        "column": 2
      },
      "package_file": "packages/yanlingrpa.com__yanling__protocol__appgui.json"
    },
    {
      "id": "yanlingrpa.com/yanling/protocol/appgui#KeyPower",
      "name": "KeyPower",
      "qualified_name": "yanlingrpa.com/yanling/protocol/appgui.KeyPower",
      "kind": "const",
      "package": "appgui",
      "import_path": "yanlingrpa.com/yanling/protocol/appgui",
      "source": {
        "file": "appgui/appgui_const_enum.go",
        "line": 21,
        "column": 2
      },
      "package_file": "packages/yanlingrpa.com__yanling__protocol__appgui.json"
    },
    {
      "id": "yanlingrpa.com/yanling/protocol/appgui#KeyPrevious",
      "name": "KeyPrevious",
      "qualified_name": "yanlingrpa.com/yanling/protocol/appgui.KeyPrevious",
      "kind": "const",
      "package": "appgui",
      "import_path": "yanlingrpa.com/yanling/protocol/appgui",
      "source": {
        "file": "appgui/appgui_const_enum.go",
        "line": 30,
        "column": 2
      },
      "package_file": "packages/yanlingrpa.com__yanling__protocol__appgui.json"
    },
    {
      "id": "yanlingrpa.com/yanling/protocol/appgui#KeyRecent",
      "name": "KeyRecent",
      "qualified_name": "yanlingrpa.com/yanling/protocol/appgui.KeyRecent",
      "kind": "const",
      "package": "appgui",
      "import_path": "yanlingrpa.com/yanling/protocol/appgui",
      "source": {
        "file": "appgui/appgui_const_enum.go",
        "line": 13,
        "column": 2
      },
      "package_file": "packages/yanlingrpa.com__yanling__protocol__appgui.json"
    },
    {
      "id": "yanlingrpa.com/yanling/protocol/appgui#KeySearch",
      "name": "KeySearch",
      "qualified_name": "yanlingrpa.com/yanling/protocol/appgui.KeySearch",
      "kind": "const",
      "package": "appgui",
      "import_path": "yanlingrpa.com/yanling/protocol/appgui",
      "source": {
        "file": "appgui/appgui_const_enum.go",
        "line": 27,
        "column": 2
      },
      "package_file": "packages/yanlingrpa.com__yanling__protocol__appgui.json"
    },
    {
      "id": "yanlingrpa.com/yanling/protocol/appgui#KeySpace",
      "name": "KeySpace",
      "qualified_name": "yanlingrpa.com/yanling/protocol/appgui.KeySpace",
      "kind": "const",
      "package": "appgui",
      "import_path": "yanlingrpa.com/yanling/protocol/appgui",
      "source": {
        "file": "appgui/appgui_const_enum.go",
        "line": 31,
        "column": 2
      },
      "package_file": "packages/yanlingrpa.com__yanling__protocol__appgui.json"
    },
    {
      "id": "yanlingrpa.com/yanling/protocol/appgui#KeyTab",
      "name": "KeyTab",
      "qualified_name": "yanlingrpa.com/yanling/protocol/appgui.KeyTab",
      "kind": "const",
      "package": "appgui",
      "import_path": "yanlingrpa.com/yanling/protocol/appgui",
      "source": {
        "file": "appgui/appgui_const_enum.go",
        "line": 26,
        "column": 2
      },
      "package_file": "packages/yanlingrpa.com__yanling__protocol__appgui.json"
    },
    {
      "id": "yanlingrpa.com/yanling/protocol/appgui#KeyVolumeDown",
      "name": "KeyVolumeDown",
      "qualified_name": "yanlingrpa.com/yanling/protocol/appgui.KeyVolumeDown",
      "kind": "const",
      "package": "appgui",
      "import_path": "yanlingrpa.com/yanling/protocol/appgui",
      "source": {
        "file": "appgui/appgui_const_enum.go",
        "line": 17,
        "column": 2
      },
      "package_file": "packages/yanlingrpa.com__yanling__protocol__appgui.json"
    },
    {
      "id": "yanlingrpa.com/yanling/protocol/appgui#KeyVolumeMute",
      "name": "KeyVolumeMute",
      "qualified_name": "yanlingrpa.com/yanling/protocol/appgui.KeyVolumeMute",
      "kind": "const",
      "package": "appgui",
      "import_path": "yanlingrpa.com/yanling/protocol/appgui",
      "source": {
        "file": "appgui/appgui_const_enum.go",
        "line": 18,
        "column": 2
      },
      "package_file": "packages/yanlingrpa.com__yanling__protocol__appgui.json"
    },
    {
      "id": "yanlingrpa.com/yanling/protocol/appgui#KeyVolumeUp",
      "name": "KeyVolumeUp",
      "qualified_name": "yanlingrpa.com/yanling/protocol/appgui.KeyVolumeUp",
      "kind": "const",
      "package": "appgui",
      "import_path": "yanlingrpa.com/yanling/protocol/appgui",
      "source": {
        "file": "appgui/appgui_const_enum.go",
        "line": 16,